{
  "air_version": "1.0",
  "agent_id": "fraud-detector-with-memory",
  "total_observations": 4721,
  "confidence": 0.94,
  "action_distribution": {
    "read": 0.71,
    "write": 0.22,
    "query": 0.07
  },
  "target_distribution": {
    "transactions.*": 0.71,
    "cases.flags": 0.22,
    "notifications.compliance": 0.07
  },
  "temporal_profile": {
    "peak_hours": [9, 10, 14, 15],
    "burst_threshold": 12.4,
    "avg_actions_per_hour": 4.2
  },
  "outcome_distribution": {
    "ALLOW": 0.89,
    "DENY": 0.06,
    "ESCALATE": 0.05
  },
  "drift_baseline_jsd": 0.08
}
